ticker,name,market,locale,primary_exchange,type,active,currency_name,cik,composite_figi,share_class_figi,last_updated_utc
A,Agilent Technologies Inc.,stocks,us,XNYS,CS,True,usd,0001090872,BBG000C2V3D6,BBG001SCTQY4,2025-12-17T07:08:11.582832709Z
AA,Alcoa Corporation,stocks,us,XNYS,CS,True,usd,0001675149,BBG00B3T3HD3,BBG00B3T3HF1,2025-12-17T07:08:11.582834543Z
AAA,Alternative Access First Priority CLO Bond ETF,stocks,us,ARCX,ETF,True,usd,0001776878,BBG01B0JRCS6,BBG01B0JRCT5,2025-12-17T07:08:11.582834693Z
AAAA,Amplius Aggressive Asset Allocation ETF,stocks,us,BATS,ETF,True,usd,,BBG01W275XX6,BBG01W275ZB5,2025-12-17T07:08:11.582834873Z
AAAC,Columbia AAA CLO ETF,stocks,us,ARCX,ETF,True,usd,0001551950,BBG01YZNRVY0,BBG01YZNRWV1,2025-12-17T07:08:11.582834994Z
AAAU,Goldman Sachs Physical Gold ETF Shares,stocks,us,BATS,ETF,True,usd,0001708646,BBG00LPXX872,BBG00LPXX8Z1,2025-12-17T07:08:11.582835124Z
AACB,Artius II Acquisition Inc. Class A Ordinary Shares,stocks,us,XNAS,CS,True,usd,0002034334,,,2025-12-17T07:08:11.582835254Z
AACBR,Artius II Acquisition Inc. Rights,stocks,us,XNAS,RIGHT,True,usd,0002034334,,,2025-12-17T07:08:11.582835394Z
AACBU,Artius II Acquisition Inc. Units,stocks,us,XNAS,UNIT,True,usd,0002034334,,,2025-12-17T07:08:11.582835665Z
AACG,ATA Creativity Global American Depositary Shares,stocks,us,XNAS,ADRC,True,usd,0001420529,BBG000V2S3P6,BBG001T125S9,2025-12-17T07:08:11.582836056Z
AADR,AdvisorShares Dorsey Wright ADR ETF,stocks,us,XNAS,ETF,True,usd,0001408970,BBG000BDYRW6,BBG001T9B1Y4,2025-12-17T07:08:11.582836196Z
AAEQ,Alpha Architect US Equity 2 ETF,stocks,us,XNAS,ETF,True,usd,,BBG01YY0GN44,BBG01YY0GP12,2025-12-17T07:08:11.582836326Z
AAL,American Airlines Group Inc.,stocks,us,XNAS,CS,True,usd,0000006201,BBG005P7Q881,BBG005P7Q907,2025-12-17T07:08:11.582836466Z
AALG,Leverage Shares 2X Long AAL Daily ETF,stocks,us,XNAS,ETF,True,usd,0001976322,BBG01VH49P35,BBG01VH49Q06,2025-12-17T07:08:11.582836597Z
AAM,AA Mission Acquisition Corp.,stocks,us,XNYS,CS,True,usd,0002012964,,,2025-12-17T07:08:11.582836737Z
AAM.U,"AA Mission Acquisition Corp. Units, each consisting of one Class A Ordinary Share and one-half of one redeemable warrant",stocks,us,XNYS,UNIT,True,usd,0002012964,,,2025-12-17T07:08:11.582836857Z
AAM.WS,"AA Mission Acquisition Corp. Warrants, each whole warrant entitles the holder to purchase one Class A ordinary share at a price of $11.50 per share",stocks,us,XNYS,WARRANT,True,usd,0002012964,,,2025-12-17T07:08:11.582837098Z
AAME,Atlantic American Corp,stocks,us,XNAS,CS,True,usd,0000008177,BBG000B9XB24,BBG001S5N8T1,2025-12-17T07:08:11.582837228Z
AAMI,Acadian Asset Management Inc.,stocks,us,XNYS,CS,True,usd,0001748824,BBG00P2HLNY3,BBG00P2HLNZ2,2025-12-17T07:08:11.582837358Z
AAOI,"Applied Optoelectronics, Inc.",stocks,us,XNAS,CS,True,usd,0001158114,BBG000D6VW15,BBG001SG47G4,2025-12-17T07:08:11.582837478Z
AAON,Aaon Inc,stocks,us,XNAS,CS,True,usd,0000824142,BBG000C2LZP3,BBG001S6CZK0,2025-12-17T07:08:11.582837599Z
AAP,ADVANCE AUTO PARTS INC,stocks,us,XNYS,CS,True,usd,0001158449,BBG000F7RCJ1,BBG001SD2SB2,2025-12-17T07:08:11.582837739Z
AAPB,GraniteShares ETF Trust GraniteShares 2x Long AAPL Daily ETF,stocks,us,XNAS,ETF,True,usd,0001689873,BBG0193F21N2,BBG0193F22H7,2025-12-17T07:08:11.582837859Z
AAPD,Direxion Daily AAPL Bear 1X Shares,stocks,us,XNAS,ETF,True,usd,,BBG0193YGJ57,BBG0193YGK09,2025-12-17T07:08:11.582837989Z
AAPG,Ascentage Pharma Group International American Depository Shares,stocks,us,XNAS,ADRC,True,usd,0002023311,BBG01RJXM9C9,BBG01RJXMB89,2025-12-17T07:08:11.58283812Z
AAPL,Apple Inc.,stocks,us,XNAS,CS,True,usd,0000320193,BBG000B9XRY4,BBG001S5N8V8,2025-12-17T07:08:11.58283854Z
AAPR,Innovator Equity Defined Protection ETF - 2 Yr to April 2026,stocks,us,BATS,ETF,True,usd,0001415726,BBG01M698CQ1,BBG01M698DK5,2025-12-17T07:08:11.582838801Z
AAPU,Direxion Shares ETF Trust Direxion Daily AAPL Bull 2X Shares,stocks,us,XNAS,ETF,True,usd,,BBG0193YBZ92,BBG0193YC043,2025-12-17T07:08:11.582839412Z
AAPW,Roundhill AAPL WeeklyPay ETF,stocks,us,BATS,ETF,True,usd,,BBG01SCFVRC3,BBG01SCFVS86,2025-12-17T07:08:11.582839542Z
AAPX,T-Rex 2X Long Apple Daily Target ETF,stocks,us,BATS,ETF,True,usd,,BBG01KY72SD3,BBG01KY72T78,2025-12-17T07:08:11.582839763Z
AAPY,Kurv Yield Premium Strategy Apple (AAPL) ETF,stocks,us,BATS,ETF,True,usd,0001848758,BBG01QY0GMH9,BBG01QY0GNH7,2025-12-17T07:08:11.582839883Z
AARD,"Aardvark Therapeutics, Inc. Common Stock",stocks,us,XNAS,CS,True,usd,0001774857,BBG01223DLB2,BBG01223DLC1,2025-12-17T07:08:11.582840013Z
AAT,"AMERICAN ASSETS TRUST, INC.",stocks,us,XNYS,CS,True,usd,0001500217,BBG00161BCR0,BBG001TCBJS5,2025-12-17T07:08:11.582840143Z
AAUC,Allied Gold Corporation,stocks,us,XNYS,CS,True,usd,0001993344,BBG01K0WWT59,BBG01J3PPZ58,2025-12-17T07:08:11.582840274Z
AAUM,Tema Alternative Asset Managers ETF,stocks,us,BATS,ETF,True,usd,0002056807,BBG01X2NVVB8,BBG01X2NVW80,2025-12-17T07:08:11.582840404Z
AAUS,Alpha Architect US Equity ETF,stocks,us,XNAS,ETF,True,usd,,BBG01W26H9C1,BBG01W26HBL6,2025-12-17T07:08:11.582840534Z
AAVM,EA Series Trust Alpha Architect Global Factor Equity ETF,stocks,us,XNAS,ETF,True,usd,,BBG00GM1DQV1,BBG00GM1DRK1,2025-12-17T07:08:11.582840654Z
AAXJ,iShares MSCI All Country Asia ex Japan ETF,stocks,us,XNAS,ETF,True,usd,0001100663,BBG000G6GXC5,BBG001T2V2D8,2025-12-17T07:08:11.582840795Z
AB,"AllianceBernstein Holding, L.P.",stocks,us,XNYS,CS,True,usd,0000825313,BBG000B9WM03,BBG001S5N9S0,2025-12-17T07:08:11.582840915Z
ABAT,American Battery Technology Company Common Stock,stocks,us,XNAS,CS,True,usd,0001576873,BBG004M1KJN5,BBG004M1KJP3,2025-12-17T07:08:11.582841045Z
ABBV,ABBVIE INC.,stocks,us,XNYS,CS,True,usd,0001551152,BBG0025Y4RY4,BBG0025Y4RZ3,2025-12-17T07:08:11.582841356Z
ABCB,Ameris Bancorp,stocks,us,XNYS,CS,True,usd,0000351569,BBG000CDY3H5,BBG001S80PX7,2025-12-17T07:08:11.582841656Z
ABCL,AbCellera Biologics Inc. Common Shares,stocks,us,XNAS,CS,True,usd,0001703057,BBG00LLW2MF2,BBG00LLW2MH0,2025-12-17T07:08:11.582841787Z
ABCS,Alpha Blue Capital US Small-Mid Cap Dynamic ETF,stocks,us,XNAS,ETF,True,usd,,BBG01KMFQRF2,BBG01KMFQS88,2025-12-17T07:08:11.582841977Z
ABEO,Abeona Therapeutics Inc. Common Stock,stocks,us,XNAS,CS,True,usd,0000318306,BBG000DT5D52,BBG001S8T7K0,2025-12-17T07:08:11.582842107Z
ABEQ,Absolute Select Value ETF,stocks,us,ARCX,ETF,True,usd,0001199046,BBG00RHHGQY2,BBG00RHHGRP0,2025-12-17T07:08:11.582842237Z
ABEV,AMBEV S.A.,stocks,us,XNYS,ADRC,True,usd,0001565025,BBG000BN5VZ4,BBG005KLVT74,2025-12-17T07:08:11.582842368Z
ABFL,Abacus FCF Leaders ETF,stocks,us,BATS,ETF,True,usd,,BBG00DW3P010,BBG00DW3P029,2025-12-17T07:08:11.582842498Z
ABG,"Asbury Automotive Group, Inc.",stocks,us,XNYS,CS,True,usd,0001144980,BBG000BKDWB5,BBG001S9B5H5,2025-12-17T07:08:11.582842638Z
ABI,VictoryShares Pioneer Asset-Based Income ETF,stocks,us,XNAS,ETF,True,usd,,BBG01VCKWDB6,BBG01VCKWFN8,2025-12-17T07:08:11.582842758Z
ABIG,Argent Large Cap ETF,stocks,us,XNAS,ETF,True,usd,,BBG01TCJ3701,BBG01TCJ37Z3,2025-12-17T07:08:11.582842879Z
ABL,"Abacus Global Management, Inc. Class A Common Stock",stocks,us,XNAS,CS,True,usd,0001814287,BBG00VY1KB95,BBG00VY1KBC1,2025-12-17T07:08:11.582843009Z
ABLD,Abacus FCF Real Assets Leaders ETF,stocks,us,BATS,ETF,True,usd,,BBG0141PBK24,BBG0141PBL04,2025-12-17T07:08:11.582843139Z
ABLG,Abacus FCF International Leaders ETF,stocks,us,BATS,ETF,True,usd,,BBG00H1J5D96,BBG00H1J5FN5,2025-12-17T07:08:11.582843259Z
ABLLL,"Abacus Global Management, Inc. 9.875% Fixed Rate Senior Notes due 2028",stocks,us,XNAS,CS,True,usd,0001814287,,,2025-12-17T07:08:11.58284339Z
ABLS,Abacus FCF Small Cap Leaders ETF,stocks,us,BATS,ETF,True,usd,,BBG01SCGBTV8,BBG01SCGBVT6,2025-12-17T07:08:11.58284353Z
ABLV,Able View Global Inc. Class B Ordinary Shares,stocks,us,XNAS,CS,True,usd,0001957489,,,2025-12-17T07:08:11.58284366Z
ABLVW,Able View Global Inc. Warrant,stocks,us,XNAS,WARRANT,True,usd,0001957489,,,2025-12-17T07:08:11.582844251Z
ABM,"ABM Industries, Inc.",stocks,us,XNYS,CS,True,usd,0000771497,BBG000B9YYH7,BBG001S5N9B8,2025-12-17T07:08:11.582844522Z
ABNB,"Airbnb, Inc. Class A Common Stock",stocks,us,XNAS,CS,True,usd,0001559720,BBG001Y2XS07,BBG001Y2XS16,2025-12-17T07:08:11.582844662Z
ABNG,Leverage Shares 2x Long ABNB Daily ETF,stocks,us,XNAS,ETF,True,usd,0001976322,BBG01YJKQMJ2,BBG01YJKQP87,2025-12-17T07:08:11.582844792Z
ABNY,YieldMax ABNB Option Income Strategy ETF,stocks,us,ARCX,ETS,True,usd,,BBG01JHFMD75,BBG01JHFMF34,2025-12-17T07:08:11.582844922Z
ABOS,"Acumen Pharmaceuticals, Inc. Common Stock",stocks,us,XNAS,CS,True,usd,0001576885,BBG0058YJ317,BBG0058YJ326,2025-12-17T07:08:11.582845043Z
ABOT,Abacus FCF Innovation Leaders ETF,stocks,us,BATS,ETF,True,usd,,BBG00YC69CJ2,BBG00YC69DC7,2025-12-17T07:08:11.582845183Z
ABP,"Abpro Holdings, Inc Common Stock",stocks,us,XNAS,CS,True,usd,0001893219,BBG013X0S7F3,BBG013X0S889,2025-12-17T07:08:11.582845303Z
ABPWW,"Abpro Holdings, Inc. Warrant",stocks,us,XNAS,WARRANT,True,usd,,BBG0142NHSW2,,2025-12-17T07:08:11.582845433Z
ABR,"Arbor Realty Trust, Inc.",stocks,us,XNYS,CS,True,usd,0001253986,BBG000KMVDV1,BBG001SJP3G4,2025-12-17T07:08:11.582845564Z
ABRpD,"Arbor Realty Trust, Inc. 6.375% Series D Cumulative Redeemable Preferred Stock, Liquidation Preference $25.00 per Share",stocks,us,XNYS,PFD,True,usd,0001253986,,,2025-12-17T07:08:11.582845694Z
ABRpE,"Arbor Realty Trust, Inc. 6.25% Series E Cumulative Redeemable Preferred Stock",stocks,us,XNYS,PFD,True,usd,0001253986,,,2025-12-17T07:08:11.582845824Z
ABRpF,"Arbor Realty Trust, Inc. 6.25% Series F Fixed-to-Floating Rate Cumulative Redeemable Preferred Stock, Liquidation Preference $25.00 per share",stocks,us,XNYS,PFD,True,usd,0001253986,,,2025-12-17T07:08:11.582845954Z
ABSI,Absci Corporation Common Stock,stocks,us,XNAS,CS,True,usd,0001672688,BBG011N54CJ8,BBG011N54DC3,2025-12-17T07:08:11.582846085Z
ABT,Abbott Laboratories,stocks,us,XNYS,CS,True,usd,0000001800,BBG000B9ZXB4,BBG001S5N9M6,2025-12-17T07:08:11.582846215Z
ABTC,American Bitcoin Corp. Class A Common Stock,stocks,us,XNAS,CS,True,usd,0001755953,BBG00MS8GZP1,BBG00MS8GZQ0,2025-12-17T07:08:11.582846335Z
ABTS,Abits Group Inc Ordinary Shares,stocks,us,XNAS,CS,True,usd,0001864055,,,2025-12-17T07:08:11.582847217Z
ABUS,Arbutus Biopharma Corporation Common Stock,stocks,us,XNAS,CS,True,usd,0001447028,BBG000RR8V85,BBG001S6RSK0,2025-12-17T07:08:11.582847367Z
ABVC,"ABVC BioPharma, Inc. Common Stock",stocks,us,XNAS,CS,True,usd,0001173313,BBG000Q844Z2,BBG001SMCS49,2025-12-17T07:08:11.582847507Z
ABVE,Above Food Ingredients Inc. Common Stock,stocks,us,XNAS,CS,True,usd,0001979484,BBG01NGG37N1,BBG01NGG37P9,2025-12-17T07:08:11.582847628Z
ABVEW,Above Food Ingredients Inc. Warrants,stocks,us,XNAS,WARRANT,True,usd,0001979484,BBG01NKYQFV5,,2025-12-17T07:08:11.582847768Z
ABVX,Abivax SA American Depositary Shares,stocks,us,XNAS,ADRC,True,usd,0001956827,BBG01JLQNZ03,BBG01JLQNZV9,2025-12-17T07:08:11.582847898Z
ABXB,Abacus Flexible Bond Leaders ETF,stocks,us,BATS,ETF,True,usd,,BBG00YC5ZT62,BBG00YC5ZV49,2025-12-17T07:08:11.582848028Z
ACA,"Arcosa, Inc. Common Stock",stocks,us,XNYS,CS,True,usd,0001739445,BBG00JGMWFM9,BBG00JGMWGB9,2025-12-17T07:08:11.582848159Z
ACAD,Acadia Pharmaceuticals Inc.,stocks,us,XNAS,CS,True,usd,0001070494,BBG000BHG9K0,BBG001SB06N3,2025-12-17T07:08:11.582848289Z
ACB,Aurora Cannabis Inc. Common Shares,stocks,us,XNAS,CS,True,usd,0001683541,BBG006SCSYG7,BBG001SV77D1,2025-12-17T07:08:11.582848419Z
ACCL,Acco Group Holdings Limited Ordinary Shares,stocks,us,XNAS,CS,True,usd,0002038378,,,2025-12-17T07:08:11.582848539Z
ACCO,Acco Brands Corporation,stocks,us,XNYS,CS,True,usd,0000712034,BBG000J06K07,BBG001SPBTK3,2025-12-17T07:08:11.58284866Z
ACCS,ACCESS Newswire Inc.,stocks,us,XASE,CS,True,usd,0000843006,BBG000C1CK87,BBG001S67C09,2025-12-17T07:08:11.58284879Z
ACDC,ProFrac Holding Corp. Class A Common Stock,stocks,us,XNAS,CS,True,usd,0001881487,BBG013PRYPJ2,BBG013PRYQC7,2025-12-17T07:08:11.58284891Z
ACEI,Innovator Equity Autocallable Income Strategy ETF,stocks,us,ARCX,ETF,True,usd,0001415726,BBG01XK51Q67,BBG01XK51R47,2025-12-17T07:08:11.58284904Z
ACEL,"Accel Entertainment, Inc.",stocks,us,XNYS,CS,True,usd,0001698991,BBG00GX221W3,BBG00GX221Z0,2025-12-17T07:08:11.582849171Z
ACEP,ARS Core Equity Portfolio ETF,stocks,us,XNAS,ETF,True,usd,,BBG01YLHMRZ1,BBG01YLHMSY0,2025-12-17T07:08:11.582849702Z
ACES,ALPS Clean Energy ETF,stocks,us,ARCX,ETF,True,usd,0001414040,BBG00L99FCT0,BBG00L99FDK7,2025-12-17T07:08:11.582849992Z
ACET,"Adicet Bio, Inc. Common Stock",stocks,us,XNAS,CS,True,usd,0001720580,BBG00JCXSJP3,BBG00JCXSJQ2,2025-12-17T07:08:11.582850122Z
ACFN,"Acorn Energy, Inc. Common Stock",stocks,us,XNAS,CS,True,usd,0000880984,BBG000CMY866,BBG001S6ZZ25,2025-12-17T07:08:11.582850253Z
ACGL,Arch Capital Group Ltd,stocks,us,XNAS,CS,True,usd,0000947484,,,2025-12-17T07:08:11.582850383Z
ACGLN,"Arch Capital Group Ltd. Depositary Shares, each Representing a 1/1,000th Interest in a 4.550% Non-Cumulative Preferred Share, Series G",stocks,us,XNAS,CS,True,usd,0000947484,,,2025-12-17T07:08:11.582850513Z
ACGLO,"Arch Capital Group Ltd. Depositary Shares Each Representing 1/1,000th Interest in a Share of 5.45% Non-Cumulative Preferred Shares, Series F",stocks,us,XNAS,PFD,True,usd,0000947484,,,2025-12-17T07:08:11.582850643Z
ACGR,American Century Large Cap Growth ETF,stocks,us,ARCX,ETF,True,usd,0001481714,BBG011MFL031,BBG011MFL0Y7,2025-12-17T07:08:11.582850764Z
ACHC,"Acadia Healthcare Company, Inc.",stocks,us,XNAS,CS,True,usd,0001520697,BBG000FPNN38,BBG001SNNWL7,2025-12-17T07:08:11.582851054Z
ACHR,Archer Aviation Inc.,stocks,us,XNYS,CS,True,usd,0001824502,BBG00XRTC910,BBG00XRTC929,2025-12-17T07:08:11.582851174Z
ACHR.WS,"Archer Aviation Inc. Redeemable Warrants, each whole warrant exercisable for one Class A common stock at an exercise price of $11.50",stocks,us,XNYS,WARRANT,True,usd,0001824502,BBG00YGCV1N9,,2025-12-17T07:08:11.582851375Z
ACHV,"Achieve Life Sciences, Inc.",stocks,us,XNAS,CS,True,usd,0000949858,BBG000FB8S62,BBG001S8JF14,2025-12-17T07:08:11.582851495Z
ACI,"Albertsons Companies, Inc.",stocks,us,XNYS,CS,True,usd,0001646972,BBG009KG1750,BBG009KG1741,2025-12-17T07:08:11.582851615Z
ACIC,American Coastal Insurance Corporation Common Stock,stocks,us,XNAS,CS,True,usd,0001401521,BBG000TKFJQ7,BBG001T09W05,2025-12-17T07:08:11.582851735Z
ACII,Innovator Index Autocallable Income Strategy ETF,stocks,us,ARCX,ETF,True,usd,0001838614,BBG01XK52JX2,BBG01XK52KW0,2025-12-17T07:08:11.582851856Z
ACIO,Aptus Collared Investment Opportunity ETF,stocks,us,BATS,ETF,True,usd,0001539639,BBG00PNSDFF3,BBG00PNSDG52,2025-12-17T07:08:11.582851976Z
ACIU,AC Immune SA,stocks,us,XNAS,CS,True,usd,0001651625,,,2025-12-17T07:08:11.582852367Z
ACIW,"ACI Worldwide, Inc.",stocks,us,XNAS,CS,True,usd,0000935036,BBG000PMBV39,BBG001S9KLL5,2025-12-17T07:08:11.582852507Z
ACKY,VistaShares Target 15 ACKtivist Distribution ETF,stocks,us,ARCX,ETF,True,usd,0001722388,BBG01WHYZLL7,BBG01WHYZMG1,2025-12-17T07:08:11.582852677Z
ACLC,American Century Large Cap Equity ETF,stocks,us,ARCX,ETF,True,usd,0001481714,BBG00W0JV9Q5,BBG00W0JVBH0,2025-12-17T07:08:11.582852807Z
ACLO,TCW AAA CLO ETF,stocks,us,XNYS,ETF,True,usd,0001831313,BBG01QPVFLN7,BBG01QPVFMJ0,2025-12-17T07:08:11.582852958Z
ACLS,Axcelis Technologies Inc,stocks,us,XNAS,CS,True,usd,0001113232,BBG000DW34S2,BBG001SF8W86,2025-12-17T07:08:11.582853088Z
ACLX,"Arcellx, Inc. Common Stock",stocks,us,XNAS,CS,True,usd,0001786205,BBG00QHJM4S9,BBG00QHJM4W4,2025-12-17T07:08:11.582853218Z
ACM,Aecom,stocks,us,XNYS,CS,True,usd,0000868857,BBG000F61RJ8,BBG001SKTTF1,2025-12-17T07:08:11.582853349Z
ACMR,"ACM Research, Inc. Class A Common Stock",stocks,us,XNAS,CS,True,usd,0001680062,BBG00HPSG933,BBG00HPSG942,2025-12-17T07:08:11.582853469Z
ACN,Accenture PLC,stocks,us,XNYS,CS,True,usd,0001467373,,,2025-12-17T07:08:11.582853599Z
ACNB,ACNB Corp,stocks,us,XNAS,CS,True,usd,0000715579,BBG000BJ2LY9,BBG001S6CVZ3,2025-12-17T07:08:11.582853729Z
ACNT,Ascent Industries Co. Common Stock,stocks,us,XNAS,CS,True,usd,0000095953,BBG000CLRHW7,BBG001S6Z1R3,2025-12-17T07:08:11.582853849Z
ACOG,Alpha Cognition Inc. Common Stock,stocks,us,XNAS,CS,True,usd,0001655923,BBG011CJPRD0,BBG00L7TXNM1,2025-12-17T07:08:11.58285398Z
ACON,"Aclarion, Inc. Common Stock",stocks,us,XNAS,CS,True,usd,0001635077,BBG014FBN4K3,BBG014FBN5N7,2025-12-17T07:08:11.58285411Z
ACONW,"Aclarion, Inc. Warrant",stocks,us,XNAS,WARRANT,True,usd,0001635077,BBG016Z2HS66,,2025-12-17T07:08:11.58285423Z
ACP,abrdn Income Credit Strategies Fund,stocks,us,XNYS,FUND,True,usd,0001503290,BBG0017VSC04,BBG001TCSLH4,2025-12-17T07:08:11.58285435Z
ACPpA,abrdn Income Credit Strategies Fund  5.250% Series A Perpetual Preferred Stock,stocks,us,XNYS,PFD,True,usd,0001503290,,,2025-12-17T07:08:11.582855162Z
ACR,ACRES Commercial Realty Corp.,stocks,us,XNYS,CS,True,usd,0001332551,BBG000HK4RX6,BBG001SP6Y91,2025-12-17T07:08:11.582855332Z
ACRE,Ares Commercial Real Estate Corporation,stocks,us,XNYS,CS,True,usd,0001529377,BBG0022MMQB0,BBG0022MMR46,2025-12-17T07:08:11.582855473Z
ACRS,"Aclaris Therapeutics, Inc.",stocks,us,XNAS,CS,True,usd,0001557746,BBG003LF0QR9,BBG003LF0QS8,2025-12-17T07:08:11.582855683Z
ACRV,"Acrivon Therapeutics, Inc. Common Stock",stocks,us,XNAS,CS,True,usd,0001781174,BBG011RWR2Q4,BBG011RWR2R3,2025-12-17T07:08:11.582855984Z
ACRpC,"ACRES Commercial Realty Corp. 8.625% Fixed-to-Floating Series C Cumulative Redeemable Preferred Stock, par value $0.001 per share",stocks,us,XNYS,PFD,True,usd,0001332551,,,2025-12-17T07:08:11.582856224Z
ACRpD,ACRES Commercial Realty Corp. 7.875% Series D Cumulative Redeemable Preferred Stock,stocks,us,XNYS,PFD,True,usd,0001332551,,,2025-12-17T07:08:11.582856374Z
ACSG,American Century Small Cap Growth Insights ETF,stocks,us,BATS,ETF,True,usd,,BBG01XQ53YJ8,BBG01XQ53ZM1,2025-12-17T07:08:11.582856495Z
ACSI,American Customer Satisfaction ETF,stocks,us,BATS,ETF,True,usd,0001387131,BBG00F40VFY6,BBG00F40VGP4,2025-12-17T07:08:11.582857086Z
ACSV,American Century Small Cap Value Insights ETF,stocks,us,BATS,ETF,True,usd,,BBG01XQ5CXM6,BBG01XQ5D083,2025-12-17T07:08:11.582857456Z
ACT,"Enact Holdings, Inc. Common Stock",stocks,us,XNAS,CS,True,usd,0001823529,BBG00WSNP4R3,BBG00WSNP4S2,2025-12-17T07:08:11.582857597Z
ACTG,Acacia Research Corporation,stocks,us,XNAS,CS,True,usd,0000934549,BBG000KF9J02,BBG001SJLJT9,2025-12-17T07:08:11.582857717Z
ACTU,"Actuate Therapeutics, Inc. Common stock",stocks,us,XNAS,CS,True,usd,0001652935,BBG00NK7LK03,BBG00NK7LK12,2025-12-17T07:08:11.582857837Z
ACU,Acme United Corporation,stocks,us,XASE,CS,True,usd,0000002098,BBG000BB3LM8,BBG001S5NCC0,2025-12-17T07:08:11.582857957Z
ACV,Virtus Diversified Income & Convertible Fund,stocks,us,XNYS,FUND,True,usd,0001636289,BBG008HMBD22,BBG008HMBD31,2025-12-17T07:08:11.582858098Z
ACVA,ACV Auctions Inc.,stocks,us,XNYS,CS,True,usd,0001637873,BBG00G5JGQ66,BBG00G5JGQ75,2025-12-17T07:08:11.582858268Z
ACVF,American Conservative Values ETF,stocks,us,ARCX,ETF,True,usd,,BBG00Y04Q9T7,BBG00Y04QBN8,2025-12-17T07:08:11.582858599Z
ACVT,Advent Convertible Bond ETF,stocks,us,ARCX,ETF,True,usd,,BBG01TQ0YGP6,BBG01TQ0YHK9,2025-12-17T07:08:11.582858729Z
ACWI,iShares MSCI ACWI ETF,stocks,us,XNAS,ETF,True,usd,0001100663,BBG000TH6VB3,BBG001S56QV7,2025-12-17T07:08:11.582858899Z
ACWV,iShares MSCI Global Min Vol Factor ETF,stocks,us,BATS,ETF,True,usd,0001100663,BBG0025X38X0,BBG0025X39Q6,2025-12-17T07:08:11.582859029Z
ACWX,iShares MSCI ACWI ex US ETF,stocks,us,XNAS,ETF,True,usd,0001100663,BBG000TH7DF8,BBG001S56R18,2025-12-17T07:08:11.58285916Z
ACXP,"Acurx Pharmaceuticals, Inc. Common Stock",stocks,us,XNAS,CS,True,usd,0001736243,BBG01184DNJ4,BBG01184DNK2,2025-12-17T07:08:11.58285928Z
AD,"Array Digital Infrastructure, Inc.",stocks,us,XNYS,CS,True,usd,0000821130,BBG000BW6P59,BBG001S5X446,2025-12-17T07:08:11.58285942Z
ADAG,Adagene Inc. American Depositary Shares,stocks,us,XNAS,ADRC,True,usd,0001818838,BBG00YZ6BYJ6,BBG00YZ6BZC0,2025-12-17T07:08:11.58285956Z
ADAM,"Adamas Trust, Inc. Common Stock",stocks,us,XNAS,CS,True,usd,0001273685,BBG000GZ8014,BBG001SHHBR7,2025-12-17T07:08:11.582859681Z
ADAMG,"Adamas Trust, Inc. 9.125% Senior Notes Due 2030",stocks,us,XNAS,CS,True,usd,0001273685,,,2025-12-17T07:08:11.582859801Z
ADAMH,"Adamas Trust, Inc. 9.875% Senior Notes Due 2030",stocks,us,XNAS,CS,True,usd,0001273685,,,2025-12-17T07:08:11.582859931Z
ADAMI,"Adamas Trust, Inc. 9.125% Senior Notes Due 2029",stocks,us,XNAS,CS,True,usd,0001273685,,,2025-12-17T07:08:11.582860061Z
ADAML,"Adamas Trust, Inc. 6.875% Series F Fixed-to-Floating Rate Cumulative Redeemable Preferred Stock, $0.01 par value per share",stocks,us,XNAS,CS,True,usd,0001273685,,,2025-12-17T07:08:11.582860202Z
ADAMM,"Adamas Trust, Inc. 7.875% Series E Fixed-to-Floating Rate Cumulative Redeemable Preferred Stock",stocks,us,XNAS,PFD,True,usd,0001273685,,,2025-12-17T07:08:11.582860342Z
ADAMN,"Adamas Trust, Inc. 8.00% Series D Fixed-to-Floating Rate Cumulative Redeemable Preferred Stock",stocks,us,XNAS,PFD,True,usd,0001273685,,,2025-12-17T07:08:11.582860472Z
ADAMZ,"Adamas Trust, Inc. 7.000% Series G Cumulative Redeemable Preferred Stock, $0.01 par value per share",stocks,us,XNAS,CS,True,usd,0001273685,,,2025-12-17T07:08:11.582860592Z
ADBE,Adobe Inc.,stocks,us,XNAS,CS,True,usd,0000796343,BBG000BB5006,BBG001S5NCQ5,2025-12-17T07:08:11.582860883Z
ADBG,Leverage Shares 2X Long ADBE Daily ETF,stocks,us,XNAS,ETF,True,usd,0001976322,BBG01SWP6HM8,BBG01SWP6JH0,2025-12-17T07:08:11.582861013Z
ADC,Agree Realty Corporation,stocks,us,XNYS,CS,True,usd,0000917251,BBG000BC9DK0,BBG001S6RY81,2025-12-17T07:08:11.582861153Z
ADCT,ADC Therapeutics SA,stocks,us,XNYS,CS,True,usd,0001771910,,,2025-12-17T07:08:11.582861274Z
ADCpA,"Agree Realty Corporation Depositary Shares, each representing 1/1,000th of a 4.250% Series A Cumulative Redeemable Preferred Stock",stocks,us,XNYS,PFD,True,usd,0000917251,,,2025-12-17T07:08:11.582861414Z
ADEA,Adeia Inc. Common Stock,stocks,us,XNAS,CS,True,usd,0001803696,BBG00RBFBL50,BBG00RBFBL78,2025-12-17T07:08:11.582861534Z
ADFI,Anfield Dynamic Fixed Income ETF,stocks,us,BATS,ETF,True,usd,0001552947,BBG00WRFGTJ5,BBG00WRFGV91,2025-12-17T07:08:11.582861654Z
ADGM,"Adagio Medical Holdings, Inc Common Stock",stocks,us,XNAS,CS,True,usd,0002006986,BBG01P202S42,BBG01P202S60,2025-12-17T07:08:11.582861775Z
ADI,"Analog Devices, Inc.",stocks,us,XNAS,CS,True,usd,0000006281,BBG000BB6G37,BBG001S5ND38,2025-12-17T07:08:11.582862075Z
ADIL,"Adial Pharmaceuticals, Inc",stocks,us,XNAS,CS,True,usd,0001513525,BBG00HNGDTR4,BBG00HNGDTS3,2025-12-17T07:08:11.582862195Z
ADIV,Guinness Atkinson Asia Pacific Dividend Builder ETF,stocks,us,ARCX,ETF,True,usd,,BBG00ZV17TH6,BBG00ZV17VD5,2025-12-17T07:08:11.582862386Z
ADM,Archer Daniels Midland Company,stocks,us,XNYS,CS,True,usd,0000007084,BBG000BB6WG8,BBG001S5ND74,2025-12-17T07:08:11.582862516Z
ADMA,"ADMA Biologics, Inc.",stocks,us,XNAS,CS,True,usd,0001368514,BBG002NCK5M5,BBG002NCK5N4,2025-12-17T07:08:11.582862847Z
ADME,Aptus Behavioral Momentum ETF,stocks,us,BATS,ETF,True,usd,0001539639,BBG00D20HG22,BBG00D20HG31,2025-12-17T07:08:11.582862977Z
ADNT,Adient plc Ordinary Shares,stocks,us,XNYS,CS,True,usd,0001670541,,,2025-12-17T07:08:11.582863097Z
ADP,Automatic Data Processing,stocks,us,XNAS,CS,True,usd,0000008670,BBG000JG0547,BBG001S82KF6,2025-12-17T07:08:11.582863227Z
ADPT,Adaptive Biotechnologies Corporation Common Stock,stocks,us,XNAS,CS,True,usd,0001478320,BBG001J2PFF5,BBG001V0GG18,2025-12-17T07:08:11.582863578Z
ADPV,Adaptiv Select ETF,stocks,us,ARCX,ETF,True,usd,,BBG01BBJQ2C4,BBG01BBJQ3B3,2025-12-17T07:08:11.582863708Z
ADSE,ADS-TEC ENERGY PLC Ordinary Shares,stocks,us,XNAS,CS,True,usd,0001879248,,,2025-12-17T07:08:11.582863919Z
ADSEW,ADS-TEC ENERGY PLC Warrant,stocks,us,XNAS,WARRANT,True,usd,0001879248,,,2025-12-17T07:08:11.582864049Z
ADSK,Autodesk Inc,stocks,us,XNAS,CS,True,usd,0000769397,BBG000BM7HL0,BBG001S5SCD4,2025-12-17T07:08:11.582864179Z
ADT,ADT Inc.,stocks,us,XNYS,CS,True,usd,0001703056,BBG000BP9WJ1,BBG001S6VGG6,2025-12-17T07:08:11.582864299Z
ADTN,"ADTRAN Holdings, Inc. Common Stock",stocks,us,XNAS,CS,True,usd,0000926282,BBG0169CH7X9,BBG0169CH7Y8,2025-12-17T07:08:11.58286443Z
ADTX,"Aditxt, Inc. Common Stock",stocks,us,XNAS,CS,True,usd,0001726711,BBG00RDV1WS5,BBG00RDV1WT4,2025-12-17T07:08:11.58286456Z
ADUR,Aduro Clean Technologies Inc. Common Stock,stocks,us,XNAS,CS,True,usd,0001863934,BBG011F62496,BBG00N9ZZX01,2025-12-17T07:08:11.58286469Z
ADUS,Addus HomeCare Corp.,stocks,us,XNAS,CS,True,usd,0001468328,BBG000NJGX84,BBG001T56D18,2025-12-17T07:08:11.58286482Z
ADV,Advantage Solutions Inc. Class A Common Stock,stocks,us,XNAS,CS,True,usd,0001776661,BBG00PPWZ8C7,BBG00PPWZ8G3,2025-12-17T07:08:11.582865161Z
ADVB,Advanced Biomed Inc. Common Stock,stocks,us,XNAS,CS,True,usd,0001941029,BBG01HW4B3M4,BBG01HW4B3N3,2025-12-17T07:08:11.582865291Z
ADVE,Matthews Asia Dividend Active ETF,stocks,us,ARCX,ETF,True,usd,,BBG01JFHH825,BBG01JFHH923,2025-12-17T07:08:11.582865452Z
ADX,"Adams Diversified Equity Fund, Inc",stocks,us,XNYS,FUND,True,usd,0000002230,BBG000BB8MR6,BBG001S5NDV7,2025-12-17T07:08:11.582865572Z
ADXN,Addex Therapeutics Ltd American Depositary Shares,stocks,us,XNAS,ADRC,True,usd,0001574232,BBG00R48ST95,BBG00R48SV18,2025-12-17T07:08:11.582865712Z
AEAQU,Activate Energy Acquisition Corp. Unit,stocks,us,XNAS,UNIT,True,usd,0002083689,,,2025-12-17T07:08:11.582865842Z
AEBI,Aebi Schmidt Holding AG Common Stock,stocks,us,XNAS,CS,True,usd,0002048519,,,2025-12-17T07:08:11.582866193Z
AEC,Anfield Energy Inc. Common Shares,stocks,us,XNAS,CS,True,usd,0001519469,BBG002PL1DW6,BBG001V114Z2,2025-12-17T07:08:11.582866323Z
AEE,Ameren Corporation,stocks,us,XNYS,CS,True,usd,0001002910,BBG000B9X8C0,BBG001S5NF24,2025-12-17T07:08:11.582866504Z
AEF,"abrdn Emerging Markets ex-China Fund, Inc.",stocks,us,XASE,FUND,True,usd,0000846676,BBG000BGWCV5,BBG001S5QCR1,2025-12-17T07:08:11.582866624Z
AEFC,Aegon Funding Company LLC 5.10% Subordinated Notes due 2049,stocks,us,XNYS,SP,True,usd,0000769218,,,2025-12-17T07:08:11.582866754Z
