ticker,name,market,locale,primary_exchange,type,active,currency_name,cik,composite_figi,share_class_figi,last_updated_utc
BDRY,Breakwave Dry Bulk Shipping ETF,stocks,us,ARCX,ETV,True,usd,0001610940,BBG00KDXJCX5,BBG00KDXJDM5,2025-12-17T07:08:11.583035695Z
BDSX,"Biodesix, Inc. Common Stock",stocks,us,XNAS,CS,True,usd,0001439725,BBG001J2LMV6,BBG001V0G914,2025-12-17T07:08:11.583035826Z
BDTX,"Black Diamond Therapeutics, Inc. Common Stock",stocks,us,XNAS,CS,True,usd,0001701541,BBG00MS4Y0W9,BBG00MS4Y0X8,2025-12-17T07:08:11.583036276Z
BDVG,IMGP Berkshire Dividend Growth ETF,stocks,us,ARCX,ETF,True,usd,0001020425,BBG01H8T9X70,BBG01H8T9Y50,2025-12-17T07:08:11.583036767Z
BDVL,iShares Disciplined Volatility Equity Active ETF,stocks,us,XNAS,ETF,True,usd,0001761055,BBG01X70V6B8,BBG01X70V7D4,2025-12-17T07:08:11.583036928Z
BDX,"Becton, Dickinson and Co.",stocks,us,XNYS,CS,True,usd,0000010795,BBG000BCZYD3,BBG001S5P374,2025-12-17T07:08:11.583037078Z
BDYN,iShares Dynamic Equity Active ETF,stocks,us,XNAS,ETF,True,usd,0001761055,BBG01X70TSM1,BBG01X70TTQ5,2025-12-17T07:08:11.583037208Z
BE,Bloom Energy Corporation,stocks,us,XNYS,CS,True,usd,0001664703,BBG000N7KBZ3,BBG001T53509,2025-12-17T07:08:11.583037328Z
BEAG,Bold Eagle Acquisition Corp. Class A Ordinary Shares,stocks,us,XNAS,CS,True,usd,0001852207,,,2025-12-17T07:08:11.583037459Z
BEAGR,Bold Eagle Acquisition Corp. Right,stocks,us,XNAS,RIGHT,True,usd,0001852207,,,2025-12-17T07:08:11.583037589Z
BEAGU,Bold Eagle Acquisition Corp. Units,stocks,us,XNAS,UNIT,True,usd,0001852207,,,2025-12-17T07:08:11.583037709Z
BEAM,Beam Therapeutics Inc. Common Stock,stocks,us,XNAS,CS,True,usd,0001745999,BBG00KXC8646,BBG00KXC8655,2025-12-17T07:08:11.583037829Z
BEAT,"Heartbeam, Inc. Common Stock",stocks,us,XNAS,CS,True,usd,0001779372,BBG012F6HZX2,BBG012F6HZY1,2025-12-17T07:08:11.58303803Z
BEATW,"Heartbeam, Inc. Warrant",stocks,us,XNAS,WARRANT,True,usd,0001779372,BBG012XPRXX4,,2025-12-17T07:08:11.58303816Z
BEDU,"Bright Scholar Education Holdings Limited American Depositary Shares, each representing four (4) Class A Ordinary Shares",stocks,us,XNYS,ADRC,True,usd,0001696355,BBG00GGXGNN1,BBG00GGXGNP9,2025-12-17T07:08:11.58303828Z
BEDY,BNY Mellon Enhanced Dividend and Income ETF,stocks,us,XNAS,ETF,True,usd,,BBG01YVLHWF8,BBG01YVLHXC9,2025-12-17T07:08:11.58303842Z
BEDZ,AdvisorShares Hotel ETF,stocks,us,ARCX,ETF,True,usd,0001408970,BBG0106XYDN8,BBG0106XYFH0,2025-12-17T07:08:11.583038551Z
BEEM,Beam Global Common Stock,stocks,us,XNAS,CS,True,usd,0001398805,BBG000BBJG06,BBG001S7JC04,2025-12-17T07:08:11.583038681Z
BEEP,Mobile Infrastructure Corporation Common Stock,stocks,us,XNAS,CS,True,usd,0001847874,BBG0104PDLN2,BBG0104PDMH7,2025-12-17T07:08:11.583039002Z
BEEX,The Beehive ETF,stocks,us,XNAS,ETF,True,usd,0001722388,BBG01R71KKD8,BBG01R71KLC7,2025-12-17T07:08:11.583039132Z
BEEZ,Honeytree U.S. Equity ETF,stocks,us,XNAS,ETF,True,usd,,BBG01K0VKY08,BBG01K0VKYW3,2025-12-17T07:08:11.583039422Z
BEG,Leverage Shares 2x Long BE Daily ETF,stocks,us,XNAS,ETF,True,usd,,BBG01Z1RCPL8,BBG01Z1RCQT8,2025-12-17T07:08:11.583039553Z
BEGS,Rareview 2x Bull Cryptocurrency & Precious Metals ETF,stocks,us,BATS,ETF,True,usd,,BBG01S57TS58,BBG01S57TT47,2025-12-17T07:08:11.583039673Z
BEKE,KE Holdings Inc. American Depositary Shares (each representing three Class A Ordinary Shares),stocks,us,XNYS,ADRC,True,usd,0001809587,BBG00W9L9LX1,BBG00W9L9N03,2025-12-17T07:08:11.583039843Z
BELFA,Bel Fuse Inc,stocks,us,XNAS,CS,True,usd,0000729580,BBG000C28YR9,BBG001S6BRZ3,2025-12-17T07:08:11.583039973Z
BELFB,Bel Fuse Inc,stocks,us,XNAS,CS,True,usd,0000729580,BBG000DYGCS6,BBG001S93K81,2025-12-17T07:08:11.583040104Z
BELT,BlackRock ETF Trust iShares U.S. Select Equity Active ETF,stocks,us,XNAS,ETF,True,usd,0001761055,BBG01NC45LW9,BBG01NC45MS2,2025-12-17T07:08:11.583040274Z
BEMB,iShares J.P. Morgan Broad USD Emerging Markets Bond ETF,stocks,us,BATS,ETF,True,usd,0001100663,BBG01F749Y32,BBG01F749YY8,2025-12-17T07:08:11.583040434Z
BEN,"Franklin Resources, Inc.",stocks,us,XNYS,CS,True,usd,0000038777,BBG000BD0TF8,BBG001S5P3W6,2025-12-17T07:08:11.583040575Z
BENF,Beneficient Class A Common Stock,stocks,us,XNAS,CS,True,usd,0001775734,BBG00KFV0B41,BBG00KFV0B50,2025-12-17T07:08:11.583040695Z
BENFW,Beneficient Warrant,stocks,us,XNAS,WARRANT,True,usd,0001775734,BBG01FVBG8K9,,2025-12-17T07:08:11.583040815Z
BENJ,Horizon Landmark ETF,stocks,us,ARCX,ETF,True,usd,,BBG01RXYQ4R2,BBG01RXYQ6C3,2025-12-17T07:08:11.583040945Z
BEP,Brookfield Renewable Partners L.P.,stocks,us,XNYS,CS,True,usd,0001533232,,,2025-12-17T07:08:11.583041076Z
BEPC,Brookfield Renewable Corporation Class A Exchangeable Subordinate Voting Shares,stocks,us,XNYS,CS,True,usd,0001791863,BBG01RJ2V7B2,BBG01RJ2Q8X2,2025-12-17T07:08:11.583041196Z
BEPH,Brookfield BRP Holdings (Canada) Inc. 4.625% Perpetual Subordinated Notes,stocks,us,XNYS,SP,True,usd,0001533232,,,2025-12-17T07:08:11.583041476Z
BEPI,Brookfield BRP Holdings (Canada) Inc. 4.875% Perpetual Subordinated Notes,stocks,us,XNYS,SP,True,usd,0001533232,,,2025-12-17T07:08:11.583041847Z
BEPJ,Brookfield BRP Holdings (Canada) Inc. 7.250% Perpetual Subordinated Notes,stocks,us,XNYS,SP,True,usd,0001533232,,,2025-12-17T07:08:11.583041977Z
BEPpA,"Brookfield Renewable Partners L.P. 5.25% Class A Preferred Limited Partnership Units, Series 17",stocks,us,XNYS,PFD,True,usd,0001533232,,,2025-12-17T07:08:11.583042188Z
BERZ,MicroSectors FANG & Innovation -3x Inverse Leveraged ETN,stocks,us,ARCX,ETN,True,usd,0000927971,BBG0123138B5,BBG012313969,2025-12-17T07:08:11.583042458Z
BESF,Bastion Energy ETF,stocks,us,BATS,ETF,True,usd,,BBG01V8RP111,BBG01V8RP246,2025-12-17T07:08:11.583042578Z
BETA,"Beta Technologies, Inc.",stocks,us,XNYS,CS,True,usd,0001784570,BBG000MBSFT5,BBG001SQ9LQ5,2025-12-17T07:08:11.583042709Z
BETE,ProShares Bitcoin & Ether Equal Weight ETF,stocks,us,ARCX,ETF,True,usd,,BBG01JLGN2B6,BBG01JLGN351,2025-12-17T07:08:11.583042849Z
BETH,ProShares Bitcoin & Ether Market Cap Weight ETF,stocks,us,ARCX,ETF,True,usd,,BBG01JLGNB44,BBG01JLGNC06,2025-12-17T07:08:11.583042979Z
BETR,Better Home & Finance Holding Company Class A Common Stock,stocks,us,XNAS,CS,True,usd,0001835856,BBG0103VG6N0,BBG0103VG6P8,2025-12-17T07:08:11.583043099Z
BETRW,Better Home & Finance Holding Company Warrant,stocks,us,XNAS,WARRANT,True,usd,0001835856,BBG010B6T055,,2025-12-17T07:08:11.58304323Z
BETZ,Roundhill Sports Betting & iGaming ETF,stocks,us,ARCX,ETF,True,usd,0001776878,BBG00V7866V2,BBG00V7867P7,2025-12-17T07:08:11.58304337Z
BEX,Tradr 2X Long BE Daily ETF,stocks,us,BATS,ETF,True,usd,,BBG01YH4H0Q0,BBG01YH4H1N1,2025-12-17T07:08:11.5830435Z
BF.A,Brown-Forman Corporation Class A,stocks,us,XNYS,CS,True,usd,0000014693,BBG000BD2C18,BBG001S5P4G2,2025-12-17T07:08:11.58304362Z
BF.B,Brown-Forman Corporation Class B,stocks,us,XNYS,CS,True,usd,0000014693,BBG000BD2NY8,BBG001S5P4H1,2025-12-17T07:08:11.583043741Z
BFAM,BRIGHT HORIZONS FAMILY SOLUTIONS INC.,stocks,us,XNYS,CS,True,usd,0001437578,BBG003LFWP05,BBG003LFWPT4,2025-12-17T07:08:11.583043871Z
BFAP,FT Vest Bitcoin Strategy Floor15 ETF - April,stocks,us,ARCX,ETF,True,usd,0001329377,BBG01T3YN2T6,BBG01T3YN3R6,2025-12-17T07:08:11.583044582Z
BFC,Bank First Corporation Common Stock,stocks,us,XNAS,CS,True,usd,0001746109,BBG000BG27V9,BBG001S79DP6,2025-12-17T07:08:11.583044793Z
BFEB,Innovator U.S. Equity Buffer ETF - February,stocks,us,BATS,ETF,True,usd,0001482688,BBG00RHZ11C7,BBG00RHZ1235,2025-12-17T07:08:11.583044973Z
BFH,"Bread Financial Holdings, Inc.",stocks,us,XNYS,CS,True,usd,0001101215,BBG000BFNR17,BBG001S78Z50,2025-12-17T07:08:11.583045103Z
BFHpA,"Bread Financial Holdings, Inc. Depositary Shares, each representing a 1/40th interest in a share of 8.625% Non-Cumulative Perpetual Preferred Stock, Series A",stocks,us,XNYS,PFD,True,usd,0001101215,,,2025-12-17T07:08:11.583045233Z
BFIN,BankFinancial Corporation,stocks,us,XNAS,CS,True,usd,0001303942,BBG000BCD4H9,BBG001S69N21,2025-12-17T07:08:11.583045364Z
BFIX,Build Bond Innovation ETF,stocks,us,ARCX,ETF,True,usd,,BBG01462WN94,BBG01462WP99,2025-12-17T07:08:11.583045484Z
BFJL,FT Vest Bitcoin Strategy Floor15 ETF - July,stocks,us,ARCX,ETF,True,usd,0001125816,BBG01VRRV3L7,BBG01VRRV4Y1,2025-12-17T07:08:11.583045604Z
BFK,BlackRock Municipal Income Trust,stocks,us,XNYS,FUND,True,usd,0001137393,BBG000BZGJ91,BBG001SFL2F9,2025-12-17T07:08:11.583045754Z
BFLB,BufferLABS US Equity Dynamic Buffer ETF,stocks,us,BATS,ETF,True,usd,,BBG01XNY04J7,BBG01XNY0719,2025-12-17T07:08:11.583045895Z
BFLY,"Butterfly Network, Inc.",stocks,us,XNYS,CS,True,usd,0001804176,BBG00TN65975,BBG00TN65984,2025-12-17T07:08:11.583046035Z
BFLY.WS,"Butterfly Network, Inc. Redeemable Warrants, each whole warrant exercisable for one share of Class A common stock, each at an exercise price of $11.50 per share",stocks,us,XNYS,WARRANT,True,usd,0001804176,BBG00VXZJCF4,,2025-12-17T07:08:11.583046175Z
BFOC,FT Vest Bitcoin Strategy Floor15 ETF - October,stocks,us,ARCX,ETF,True,usd,0001329377,BBG01XK3K898,BBG01XK3K969,2025-12-17T07:08:11.583046346Z
BFOR,Barron's 400 ETF,stocks,us,ARCX,ETF,True,usd,0001414040,BBG004N1S4Q6,BBG004N1S5G4,2025-12-17T07:08:11.583046466Z
BFRE,Westwood LBRTY Global Equity ETF,stocks,us,ARCX,ETF,True,usd,,BBG01SX4YJH5,BBG01SX4YKM6,2025-12-17T07:08:11.583046606Z
BFRG,"Bullfrog AI Holdings, Inc. Common Stock",stocks,us,XNAS,CS,True,usd,0001829247,BBG01BXY7SH6,BBG01BXY7TD8,2025-12-17T07:08:11.583046716Z
BFRGW,"Bullfrog AI Holdings, Inc. Warrants",stocks,us,XNAS,WARRANT,True,usd,0001829247,BBG01CD99CS2,,2025-12-17T07:08:11.583047147Z
BFRI,Biofrontera Inc. Common Stock,stocks,us,XNAS,CS,True,usd,0001858685,BBG00HTD0PX0,BBG00HTD0PY9,2025-12-17T07:08:11.583047398Z
BFRIW,Biofrontera Inc. Warrants,stocks,us,XNAS,WARRANT,True,usd,0001858685,BBG013841CP0,,2025-12-17T07:08:11.583047658Z
BFRZ,Innovator Equity Managed 100 Buffer ETF,stocks,us,ARCX,ETF,True,usd,0001415726,BBG01TW7DK05,BBG01TW7DKV1,2025-12-17T07:08:11.583047979Z
BFS,"Saul Centers, Inc.",stocks,us,XNYS,CS,True,usd,0000907254,BBG000BJ5G95,BBG001S7F7J9,2025-12-17T07:08:11.583048219Z
BFST,"Business First Bancshares, Inc. Common Stock",stocks,us,XNAS,CS,True,usd,0001624322,BBG000TGZHS6,BBG001T056Q8,2025-12-17T07:08:11.583048349Z
BFSpD,"Saul Centers, Inc. Depositary Shares, each representing 1/100th of a share of 6.125% Series D Cumulative Redeemable Preferred Stock",stocks,us,XNYS,PFD,True,usd,0000907254,,,2025-12-17T07:08:11.58304865Z
BFSpE,"Saul Centers, Inc. Depositary Shares, each representing 1/100th of a share of 6.000% Series E Cumulative Redeemable Preferred Stock",stocks,us,XNYS,PFD,True,usd,0000907254,,,2025-12-17T07:08:11.58304878Z
BFZ,BLACKROCK CA MUNICIPAL INC TR,stocks,us,XNYS,FUND,True,usd,0001137391,BBG000BB9W75,BBG001S5WLM9,2025-12-17T07:08:11.5830489Z
BG,Bunge Global SA,stocks,us,XNYS,CS,True,usd,0001996862,,,2025-12-17T07:08:11.583049021Z
BGB,Blackstone Strategic Credit 2027 Term Fund,stocks,us,XNYS,FUND,True,usd,0001546429,BBG002W5R785,BBG002W5R801,2025-12-17T07:08:11.583049151Z
BGC,"BGC Group, Inc. Class A Common Stock",stocks,us,XNAS,CS,True,usd,0001094831,BBG01H9FTGX5,BBG01H9FTHS9,2025-12-17T07:08:11.583049271Z
BGDV,Bahl & Gaynor Dividend ETF,stocks,us,ARCX,ETF,True,usd,,BBG01R77QK76,BBG01R77QL56,2025-12-17T07:08:11.583049482Z
BGH,Barings Global Short Duration High Yield Fund,stocks,us,XNYS,FUND,True,usd,0001521404,BBG0034WH483,BBG0034WH517,2025-12-17T07:08:11.583049602Z
BGI,Birks Group Inc,stocks,us,XASE,CS,True,usd,0001179821,BBG000BCPBN3,BBG001S6PN78,2025-12-17T07:08:11.583049732Z
BGIG,Bahl & Gaynor Income Growth ETF,stocks,us,ARCX,ETF,True,usd,0001539639,BBG01J9TNBB2,BBG01J9TNC66,2025-12-17T07:08:11.583049862Z
BGIN,Bgin Blockchain Limited Class A Ordinary Shares,stocks,us,XNAS,CS,True,usd,0001945565,,,2025-12-17T07:08:11.583050584Z
BGL,Blue Gold Limited Class A Ordinary Shares,stocks,us,XNAS,CS,True,usd,0002019435,,,2025-12-17T07:08:11.583050714Z
BGLC,BioNexus Gene Lab Corp Common stock,stocks,us,XNAS,CS,True,usd,0001737523,BBG00N70PLY0,BBG00N70PLZ9,2025-12-17T07:08:11.583051045Z
BGLD,FT Vest Gold Strategy Quarterly Buffer ETF,stocks,us,BATS,ETF,True,usd,0001329377,BBG00YXMR9N6,BBG00YXMRBJ6,2025-12-17T07:08:11.583051185Z
BGLWW,Blue Gold Limited Warrant,stocks,us,XNAS,WARRANT,True,usd,0002019435,,,2025-12-17T07:08:11.583051315Z
BGM,BGM Group Ltd. Class A Ordinary Shares,stocks,us,XNAS,CS,True,usd,0001779578,,,2025-12-17T07:08:11.583051445Z
BGMS,"Bio Green Med Solution, Inc. Common Stock",stocks,us,XNAS,CS,True,usd,0001130166,BBG000CT3XM2,BBG001SGNL18,2025-12-17T07:08:11.583051586Z
BGMSP,"Bio Green Med Solution, Inc. 6% Convertible Preferred Stock",stocks,us,XNAS,PFD,True,usd,0001130166,,,2025-12-17T07:08:11.583051716Z
BGR,Blackrock Energy and Resources Trust,stocks,us,XNYS,FUND,True,usd,0001306550,BBG000QD1Q85,BBG001SMMW12,2025-12-17T07:08:11.583051836Z
BGRN,iShares Trust iShares USD Green Bond ETF,stocks,us,XNAS,ETF,True,usd,0001100663,BBG00MK1NPJ5,BBG00MK1NQ85,2025-12-17T07:08:11.583051956Z
BGRO,BlackRock ETF Trust iShares Large Cap Growth Active ETF,stocks,us,XNAS,ETF,True,usd,0001761055,BBG01N4ZX8Z4,BBG01N4ZX9W5,2025-12-17T07:08:11.583052076Z
BGS,"B&G Foods, Inc.",stocks,us,XNYS,CS,True,usd,0001278027,BBG000RKXRQ1,BBG001SQD861,2025-12-17T07:08:11.583052417Z
BGSF,"BGSF, Inc.",stocks,us,XNYS,CS,True,usd,0001474903,BBG005DLS9N2,BBG005DLS9P0,2025-12-17T07:08:11.583052557Z
BGSI,Boyd Group Services Inc.,stocks,us,XNYS,CS,True,usd,0002091467,BBG00RFF38P2,BBG001SFTY52,2025-12-17T07:08:11.583052718Z
BGT,BlackRock Floating Rate Income Trust,stocks,us,XNYS,FUND,True,usd,0001287480,BBG000BWND57,BBG001SCPXR1,2025-12-17T07:08:11.583052848Z
BGX,Blackstone Long-Short Credit Income Fund,stocks,us,XNYS,FUND,True,usd,0001504234,BBG001855699,BBG001TCJG67,2025-12-17T07:08:11.583052978Z
BGY,BlackRock Enhanced International Dividend Trust,stocks,us,XNYS,FUND,True,usd,0001393299,BBG000QY41Y2,BBG001SSV2L3,2025-12-17T07:08:11.583053309Z
BH,Biglari Holdings Inc. Class B Common Stock,stocks,us,XNYS,CS,True,usd,0001726173,BBG00JPRDQH1,BBG00JPRDQJ9,2025-12-17T07:08:11.583053449Z
BH.A,Biglari Holdings Inc. Class A Common Stock,stocks,us,XNYS,CS,True,usd,0001726173,BBG00KK2W379,BBG00KK2W3Y9,2025-12-17T07:08:11.583053609Z
BHAT,Blue Hat Interactive Entertainment Technology Ordinary Shares,stocks,us,XNAS,CS,True,usd,0001759136,,,2025-12-17T07:08:11.58305374Z
BHB,Bar Harbor Bankshares,stocks,us,XASE,CS,True,usd,0000743367,BBG000JKM045,BBG001SB8Q79,2025-12-17T07:08:11.58305386Z
BHC,Bausch Health Companies Inc,stocks,us,XNYS,CS,True,usd,0000885590,BBG000DLFM21,BBG001S7WDP0,2025-12-17T07:08:11.583054Z
BHE,Benchmark Electronics,stocks,us,XNYS,CS,True,usd,0000863436,BBG000C4JX31,BBG001S6LXL4,2025-12-17T07:08:11.58305413Z
BHF,"Brighthouse Financial, Inc.",stocks,us,XNAS,CS,True,usd,0001685040,BBG00DYPZ4T0,BBG00DYPZ4V7,2025-12-17T07:08:11.583054261Z
BHFAL,"Brighthouse Financial, Inc. 6.25% Junior Subordinated Debentures due 2058",stocks,us,XNAS,CS,True,usd,0001685040,,,2025-12-17T07:08:11.583054381Z
BHFAM,"Brighthouse Financial, Inc. Depositary shares each representing a 1/1,000th Interest in a Share of 4.625% Non-Cumulative Preferred Stock, Series D",stocks,us,XNAS,CS,True,usd,0001685040,,,2025-12-17T07:08:11.583054511Z
BHFAN,"Brighthouse Financial, Inc. Depositary shares, each representing a 1/1,000th interest in a share of 5.375% Non-Cumulative Preferred Stock, Series C",stocks,us,XNAS,CS,True,usd,0001685040,,,2025-12-17T07:08:11.583054631Z
BHFAO,"Brighthouse Financial, Inc. Depositary Shares 6.75% Non-Cum Pfd Series B",stocks,us,XNAS,CS,True,usd,0001685040,,,2025-12-17T07:08:11.583054762Z
BHFAP,"Brighthouse Financial, Inc. Depositary Shares 6.6% Non-Cumulative Preferred Stock, Series A",stocks,us,XNAS,PFD,True,usd,0001685040,,,2025-12-17T07:08:11.583054892Z
BHK,BLACKROCK CORE BD TR,stocks,us,XNYS,FUND,True,usd,0001160864,BBG000C09693,BBG001SFNB21,2025-12-17T07:08:11.583055022Z
BHM,"Bluerock Homes Trust, Inc.",stocks,us,XASE,CS,True,usd,0001903382,BBG0146YWXC8,BBG0146YWXD7,2025-12-17T07:08:11.583055152Z
BHP,BHP Group Limited American Depositary Shares (Each representing two Ordinary Shares),stocks,us,XNYS,ADRC,True,usd,0000811809,BBG000BD5NZ4,BBG001S5P5K4,2025-12-17T07:08:11.583055303Z
BHR,Braemar Hotels & Resorts Inc. Common Stock,stocks,us,XNYS,CS,True,usd,0001574085,BBG004PW84G9,BBG004PW8567,2025-12-17T07:08:11.583055583Z
BHRB,Burke & Herbert Financial Services Corp. Common Stock,stocks,us,XNAS,CS,True,usd,0001964333,BBG019X33P07,BBG019X33P61,2025-12-17T07:08:11.583055703Z
BHRpB,Braemar Hotels & Resorts Inc. 5.50% Series B Cumulative Convertible Preferred Stock,stocks,us,XNYS,PFD,True,usd,0001574085,,,2025-12-17T07:08:11.583055994Z
BHRpD,"Braemar Hotels & Resorts Inc. 8.25% Series D Cumulative Preferred Stock, par value $0.01 per share",stocks,us,XNYS,PFD,True,usd,0001574085,,,2025-12-17T07:08:11.583056114Z
BHST,BioHarvest Sciences Inc. Common Stock,stocks,us,XNAS,CS,True,usd,0001723464,BBG00NB02NZ5,BBG0086KQ0S2,2025-12-17T07:08:11.583056254Z
BHV,BlackRock Virginia Muni Bond Trust,stocks,us,XNYS,FUND,True,usd,0001169034,BBG000DXJJH2,BBG001SKCDT9,2025-12-17T07:08:11.583056385Z
BHVN,Biohaven Ltd.,stocks,us,XNYS,CS,True,usd,0001935979,,,2025-12-17T07:08:11.583056625Z
BHYB,Xtrackers USD High Yield BB-B ex Financials ETF,stocks,us,BATS,ETF,True,usd,,BBG01JTRL253,BBG01JTRLM68,2025-12-17T07:08:11.583056846Z
BIAF,"bioAffinity Technologies, Inc. Common Stock",stocks,us,XNAS,CS,True,usd,0001712762,BBG00H69JDX1,BBG00H69JDY0,2025-12-17T07:08:11.583057106Z
BIAFW,"bioAffinity Technologies, Inc. Warrant",stocks,us,XNAS,WARRANT,True,usd,0001712762,BBG018DZJPN8,,2025-12-17T07:08:11.583057256Z
BIB,ProShares Ultra NASDAQ Biotechnology,stocks,us,XNAS,ETF,True,usd,0001174610,BBG000QMBZX6,BBG001T7V4Q9,2025-12-17T07:08:11.583057407Z
BIBL,Inspire 100 ETF,stocks,us,ARCX,ETF,True,usd,0001733356,BBG00J3H9QW5,BBG00J3H9RL5,2025-12-17T07:08:11.583057537Z
BIDD,iShares International Dividend Active ETF,stocks,us,ARCX,ETF,True,usd,0001761055,BBG01QVVCQY0,BBG01QVVCRV1,2025-12-17T07:08:11.583057657Z
BIDU,"Baidu, Inc.",stocks,us,XNAS,ADRC,True,usd,0001329099,BBG000QXWHD1,BBG001SNBKD5,2025-12-17T07:08:11.583057787Z
BIGY,YieldMax Target 12 Big 50 Option Income ETF,stocks,us,ARCX,ETF,True,usd,,BBG01QRKG3V9,BBG01QRKG4Q3,2025-12-17T07:08:11.583057908Z
BIIB,Biogen Inc. Common Stock,stocks,us,XNAS,CS,True,usd,0000875045,BBG000C17X76,BBG001S67826,2025-12-17T07:08:11.583058038Z
BIL,State Street SPDR Bloomberg 1-3 Month T-Bill ETF,stocks,us,ARCX,ETF,True,usd,0001081019,BBG000RFQSH8,BBG001STKCW9,2025-12-17T07:08:11.583058378Z
BILD,Nomura Global Listed Infrastructure ETF,stocks,us,ARCX,ETF,True,usd,0001969995,BBG01KBR85T1,BBG01KBR86N5,2025-12-17T07:08:11.583058499Z
BILI,Bilibili Inc. American Depositary Shares,stocks,us,XNAS,ADRC,True,usd,0001723690,BBG00K7T3037,BBG00K7T30T9,2025-12-17T07:08:11.583058689Z
BILL,"BILL Holdings, Inc.",stocks,us,XNYS,CS,True,usd,0001786352,BBG00QVJV6V4,BBG00QVJV7L3,2025-12-17T07:08:11.583058819Z
BILS,State Street SPDR Bloomberg 3-12 Month T-Bill ETF,stocks,us,ARCX,ETF,True,usd,0001081019,BBG00X8RXFQ1,BBG00X8RXGK5,2025-12-17T07:08:11.58305895Z
BILT,iShares Infrastructure Active ETF,stocks,us,BATS,ETF,True,usd,0001761055,BBG01W9TSW68,BBG01W9TSX57,2025-12-17T07:08:11.58305908Z
BILZ,PIMCO Ultra Short Government Active ETF,stocks,us,ARCX,ETF,True,usd,0001450011,BBG01GZF4L55,BBG01GZF4M26,2025-12-17T07:08:11.5830592Z
BINC,iShares Flexible Income Active ETF,stocks,us,ARCX,ETF,True,usd,0001804196,BBG01GQYLJ23,BBG01GQYLJY8,2025-12-17T07:08:11.58305932Z
BINT,Bluemonte Global Equity ETF,stocks,us,ARCX,ETF,True,usd,0001452937,BBG01VD0TS93,BBG01VD0TTS0,2025-12-17T07:08:11.58305945Z
BINV,Brandes International ETF,stocks,us,BATS,ETF,True,usd,0001616265,BBG01JM52LJ2,BBG01JM52MM6,2025-12-17T07:08:11.583059571Z
BIO,"Bio-Rad Laboratories, Inc.Class A",stocks,us,XNYS,CS,True,usd,0000012208,BBG000DY28W5,BBG001S625W4,2025-12-17T07:08:11.583059711Z
BIO.B,"Bio-Rad Laboratories, Inc. Class B",stocks,us,XNYS,CS,True,usd,0000012208,BBG000BD6WM7,BBG001S5P622,2025-12-17T07:08:11.583059831Z
BIOA,"BioAge Labs, Inc. Common Stock",stocks,us,XNAS,CS,True,usd,0001709941,BBG00HBTB0M9,BBG00HBTB0N8,2025-12-17T07:08:11.583060262Z
BIOX,Bioceres Crop Solutions Corp. Ordinary Shares,stocks,us,XNAS,CS,True,usd,0001769484,,,2025-12-17T07:08:11.583060392Z
BIP,Brookfield Infrastructure Partners L.P. Limited Partnership Units,stocks,us,XNYS,CS,True,usd,0001406234,,,2025-12-17T07:08:11.583060513Z
BIPC,Brookfield Infrastructure Corporation Class A Exchangeable Subordinate Voting Shares,stocks,us,XNYS,CS,True,usd,0001788348,BBG01RJ2W204,BBG01RJ2TXY3,2025-12-17T07:08:11.583060643Z
BIPH,Brookfield Infrastructure Finance ULC 5.000% Subordinated Notes due 2081,stocks,us,XNYS,SP,True,usd,0001406234,,,2025-12-17T07:08:11.583060983Z
BIPI,BIP Bermuda Holdings I Limited 5.125% Perpetual Subordinated Notes,stocks,us,XNYS,SP,True,usd,0001406234,,,2025-12-17T07:08:11.583061104Z
BIPJ,Brookfield Infrastructure Finance ULC 7.250% Subordinated Notes due 2084,stocks,us,XNYS,SP,True,usd,0001406234,,,2025-12-17T07:08:11.583061304Z
BIPpA,"Brookfield Infrastructure Partners L.P. 5.125% Class A Preferred Limited Partnership Units, Series 13",stocks,us,XNYS,PFD,True,usd,0001406234,,,2025-12-17T07:08:11.583061544Z
BIPpB,"Brookfield Infrastructure Partners L.P. 5.000% Class A Preferred Limited Partnership Units, Series 14",stocks,us,XNYS,PFD,True,usd,0001406234,,,2025-12-17T07:08:11.583061805Z
BIRD,"Allbirds, Inc. Class A Common Stock",stocks,us,XNAS,CS,True,usd,0001653909,BBG00CCNTK76,BBG00CCNTK94,2025-12-17T07:08:11.583062086Z
BIRK,Birkenstock Holding plc,stocks,us,XNYS,CS,True,usd,0001977102,,,2025-12-17T07:08:11.583062216Z
BIS,ProShares UltraShort NASDAQ Biotechnology,stocks,us,XNAS,ETF,True,usd,0001174610,BBG000QMCF87,BBG001T7V4S7,2025-12-17T07:08:11.583062356Z
BIT,BLACKROCK MULTI-SECTOR INCOME TRUST,stocks,us,XNYS,FUND,True,usd,0001562818,BBG003P84BH1,BBG003P84C70,2025-12-17T07:08:11.583062657Z
BITB,Bitwise Bitcoin ETF,stocks,us,ARCX,ETV,True,usd,0001763415,BBG01KY66LW5,BBG01KY66MQ0,2025-12-17T07:08:11.583062797Z
BITC,Bitwise Trendwise Bitcoin and Treasuries Rotation Strategy ETF,stocks,us,ARCX,ETF,True,usd,,BBG01FZQP5S0,BBG01FZQP6S8,2025-12-17T07:08:11.583062997Z
BITF,Bitfarms Ltd. Common Stock,stocks,us,XNAS,CS,True,usd,0001812477,BBG00PZTS4J3,BBG00PGMZVM7,2025-12-17T07:08:11.583063127Z
BITI,ProShares Short Bitcoin ETF,stocks,us,ARCX,ETF,True,usd,0001174610,BBG018C3QG43,BBG018C3QH78,2025-12-17T07:08:11.583063258Z
BITK,Tuttle Capital IBIT 0DTE Covered Call ETF,stocks,us,BATS,ETF,True,usd,,BBG01XBSGXD8,BBG01XBSGYB8,2025-12-17T07:08:11.583063408Z
BITO,ProShares Bitcoin ETF,stocks,us,ARCX,ETF,True,usd,0001174610,BBG0131STJL3,BBG0131STKH5,2025-12-17T07:08:11.583063538Z
BITQ,Bitwise Crypto Industry Innovators ETF,stocks,us,ARCX,ETF,True,usd,0001452937,BBG01Y4FMRX6,BBG01Y4FMSY3,2025-12-17T07:08:11.583063658Z
BITS,Global X Blockchain & Bitcoin Strategy ETF,stocks,us,XNAS,ETF,True,usd,,BBG013J592N1,BBG013J593K2,2025-12-17T07:08:11.583064149Z
BITU,ProShares Ultra Bitcoin ETF,stocks,us,ARCX,ETF,True,usd,,BBG01M79Z7R0,BBG01M79Z8W2,2025-12-17T07:08:11.58306442Z
BITW,Bitwise 10 Crypto Index ETF,stocks,us,ARCX,ETV,True,usd,0001723788,BBG00XX0Y6R0,BBG00XX0Y7L4,2025-12-17T07:08:11.583064721Z
BITX,2x Bitcoin Strategy ETF,stocks,us,BATS,ETF,True,usd,,BBG01GXLYLP9,BBG01GXLYNB0,2025-12-17T07:08:11.583064841Z
BITY,Amplify Bitcoin 2% Monthly Option Income ETF,stocks,us,BATS,ETF,True,usd,0001633061,BBG01THXH1S3,BBG01THXH2N6,2025-12-17T07:08:11.583064961Z
BIV,Vanguard Intermediate-Term Bond ETF,stocks,us,ARCX,ETF,True,usd,0000794105,BBG000R44SW0,BBG001ST39R1,2025-12-17T07:08:11.583065141Z
BIVI,"BioVie, Inc. Common Stock",stocks,us,XNAS,CS,True,usd,0001580149,BBG00548BTD6,BBG00548BTF4,2025-12-17T07:08:11.583065272Z
BIVIW,BioVie Inc. Warrant,stocks,us,XNAS,WARRANT,True,usd,0001580149,BBG01WJZNKD6,,2025-12-17T07:08:11.583065402Z
BIXIU,Bitcoin Infrastructure Acquisition Corp Ltd. Unit,stocks,us,XNAS,UNIT,True,usd,0002082542,,,2025-12-17T07:08:11.583065592Z
BIYA,Baiya International Group Inc. Ordinary Shares,stocks,us,XNAS,CS,True,usd,0001944712,,,2025-12-17T07:08:11.583065722Z
BIZD,VanEck BDC Income ETF,stocks,us,ARCX,ETF,True,usd,0001137360,BBG00440GKJ4,BBG00440GL84,2025-12-17T07:08:11.583066203Z
BJ,"BJs Wholesale Club Holdings, Inc. Common Stock",stocks,us,XNYS,CS,True,usd,0001531152,BBG00FQ8T4G3,BBG00FQ8T4M6,2025-12-17T07:08:11.583066324Z
BJAN,Innovator U.S. Equity Buffer ETF - January,stocks,us,BATS,ETF,True,usd,0001482688,BBG00MYXK749,BBG00MYXK7W8,2025-12-17T07:08:11.583066454Z
BJDX,"Bluejay Diagnostics, Inc. Common Stock",stocks,us,XNAS,CS,True,usd,0001704287,BBG012TKJCJ1,BBG012TKJDC6,2025-12-17T07:08:11.583066584Z
BJK,VanEck Gaming ETF,stocks,us,XNAS,ETF,True,usd,0001137360,BBG000V86Z03,BBG001T1Q9C2,2025-12-17T07:08:11.583066724Z
BJRI,"BJ's Restaurants, Inc.",stocks,us,XNAS,CS,True,usd,0001013488,BBG000H9LNX1,BBG001S970P2,2025-12-17T07:08:11.583066855Z
BJUL,Innovator U.S. Equity Buffer ETF - July,stocks,us,BATS,ETF,True,usd,0001482688,BBG00LNJLC51,BBG00LNJLCX0,2025-12-17T07:08:11.583067145Z
BJUN,Innovator U.S. Equity Buffer ETF - June,stocks,us,BATS,ETF,True,usd,0001415726,BBG00PBD5ZW5,BBG00PBD60M2,2025-12-17T07:08:11.583067295Z
BK,Bank of New York Mellon Corporation,stocks,us,XNYS,CS,True,usd,0001390777,BBG000BD8PN9,BBG001S5P6Q6,2025-12-17T07:08:11.583067436Z
BKAG,BNY Mellon Core Bond ETF,stocks,us,ARCX,ETF,True,usd,,BBG00RYR56Q6,BBG00RYR57H4,2025-12-17T07:08:11.583067556Z
BKCG,BNY Mellon Concentrated Growth ETF,stocks,us,ARCX,ETF,True,usd,,BBG01SXJKVN3,BBG01SXJKWT5,2025-12-17T07:08:11.583067736Z
BKCH,Global X Blockchain ETF,stocks,us,XNAS,ETF,True,usd,0001432353,BBG011RVGZP6,BBG011RVH0K7,2025-12-17T07:08:11.583067856Z
BKCI,BNY Mellon Concentrated International ETF,stocks,us,ARCX,ETF,True,usd,,BBG013VPCK31,BBG013VPCL11,2025-12-17T07:08:11.583067997Z
